{
  "$schema": "https://json-schema.org/draft/2020-12/schema",
  "$id": "https://astrolyn.ai/schemas/business_rule.schema.json",
  "title": "BusinessRule",
  "description": "Schema for business domain event rules. Covers all 5 semantic layers: dasha, transit, fast_trigger, classical_pattern, and outcome/quality classification.",
  "type": "object",
  "additionalProperties": false,
  "required": ["rule_id","name","domain","event_family","rule_type","status","priority","conditions","outputs"],
  "properties": {
    "rule_id": {"type": "string", "minLength": 1, "description": "Unique rule identifier"},
    "name": {"type": "string", "minLength": 1},
    "description": {"type": "string"},
    "source_text": {
      "type": "object",
      "additionalProperties": true,
      "properties": {
        "work_name": {"type": "string"},
        "chapter": {"type": ["string","null"]},
        "verse": {"type": ["string","null"]},
        "page": {"type": ["string","null"]},
        "quote": {"type": ["string","null"]},
        "translation": {"type": ["string","null"]}
      }
    },
    "domain": {"type": "string", "enum": ["business"]},
    "event_family": {"type": "string", "enum": ["business_launch","business_expansion","business_closure","business_partnership","profit_growth","speculative_business","funding","scaling"]},
    "event_subtype": {"type": "array", "items": {"type": "string"}},
    "rule_type": {"type": "string", "enum": ["dasha","transit","fast_trigger","classical_pattern","compound","combination","yoga","house_activation","d9","aspect"]},
    "status": {"type": "string", "enum": ["active","experimental","calibration","deprecated"]},
    "priority": {"type": "integer", "minimum": 1, "maximum": 100},
    "polarity": {"type": "string", "enum": ["supportive","neutral","challenging","mixed"]},
    "timing_band": {"type": "string", "enum": ["broad","medium","narrow","exact","none"]},
    "conditions": {
      "type": "object",
      "required": ["all_of"],
      "properties": {
        "all_of": {"type": "array"},
        "any_of": {"type": "array"},
        "none_of": {"type": "array"}
      }
    },
    "signals": {
      "type": "object",
      "properties": {
        "dasha": {"type": "array", "items": {"type": "string"}},
        "transit": {"type": "array", "items": {"type": "string"}},
        "houses": {"type": "array", "items": {"type": "string"}},
        "planets": {"type": "array", "items": {"type": "string"}},
        "nakshatra": {"type": "array", "items": {"type": "string"}},
        "d9": {"type": "array", "items": {"type": "string"}},
        "sensitive_points": {"type": "array", "items": {"type": "string"}}
      }
    },
    "interpretation": {
      "type": "object",
      "additionalProperties": true,
      "properties": {
        "meaning": {"type": "string"},
        "mode": {"type": "string"},
        "quality": {"type": "string"},
        "confidence": {"type": "number", "minimum": 0, "maximum": 1}
      }
    },
    "window": {
      "type": ["object","null"],
      "properties": {
        "broad_window_days": {"type": "integer", "minimum": 0},
        "exact_window_days": {"type": "integer", "minimum": 0},
        "confidence_decay_days": {"type": "integer", "minimum": 0}
      }
    },
    "weights": {
      "type": "object",
      "properties": {
        "dasha_weight": {"type": "number"},
        "transit_weight": {"type": "number"},
        "fast_trigger_weight": {"type": "number"},
        "classical_weight": {"type": "number"}
      }
    },
    "outputs": {
      "type": "object",
      "required": ["symbolic_label","likelihood_band","timing_band"],
      "properties": {
        "symbolic_label": {"type": "string"},
        "likelihood_band": {"type": "string", "enum": ["very_low","low","moderate","high","very_high"]},
        "timing_band": {"type": "string", "enum": ["broad","narrow","exact","none"]},
        "recommended_action": {"type": "string"}
      }
    },
    "metadata": {"type": "object", "additionalProperties": true}
  }
}
