[
  {
    "rule_id": "phaladeepika_speculative_business_5_11",
    "name": "5th-11th Lord Connection — Speculative Business Acumen",
    "description": "The connection between the house of investments/speculation (5th) and the house of gains (11th) creates an archetype suited for speculative markets and investments.",
    "source_text": {
      "work_name": "MANTRESWARA'S PHALA DEEPIKA",
      "chapter": null,
      "verse": "29",
      "page": null,
      "quote": "If the lord of the 11th is posited in the 5th, or the lord of the 5th occupies the 11th, or the lords of the 5th and the 11th are conjoined together, with such disposition of the lords of the 5th and 11th, the prediction should be that there will be... profit in speculation because these are all signified by the 5th house.",
      "translation": null
    },
    "domain": "business",
    "event_family": "speculative_business",
    "event_subtype": ["speculative_business"],
    "rule_type": "classical_pattern",
    "status": "active",
    "priority": 90,
    "polarity": "supportive",
    "timing_band": "none",
    "conditions": {
      "all_of": [],
      "any_of": [
        "The Lord of the 11th house is positioned in the 5th house",
        "The Lord of the 5th house is positioned in the 11th house",
        "The Lords of the 5th and 11th houses are conjoined"
      ],
      "none_of": []
    },
    "signals": {
      "dasha": [],
      "transit": [],
      "houses": ["5", "11"],
      "planets": ["5th_lord", "11th_lord"],
      "nakshatra": [],
      "d9": [],
      "sensitive_points": []
    },
    "interpretation": {
      "meaning": "Symbolic indicator of speculative business acumen. The connection between the house of investments/speculation (5th) and the house of gains (11th) creates an archetype suited for speculative markets and investments.",
      "mode": "speculative_business",
      "quality": "supportive",
      "confidence": 0.9
    },
    "window": null,
    "weights": {
      "dasha_weight": 0.0,
      "transit_weight": 0.0,
      "fast_trigger_weight": 0.0,
      "classical_weight": 0.95
    },
    "outputs": {
      "symbolic_label": "speculative_business_archetype",
      "likelihood_band": "high",
      "timing_band": "none",
      "recommended_action": "leverage_speculative_instinct"
    },
    "metadata": {
      "notes": "Classical wealth combination highlighting speculative trading."
    }
  },
  {
    "rule_id": "bphs_satramooladdhana_yoga_2_6",
    "name": "Satramooladdhana Yoga — Wealth Through Conflict/Litigation",
    "description": "Satramooladdhana Yoga indicates a business archetype where wealth is extracted from conflict, enemies, or litigation. It suggests a career managing the debts, legal disputes, or failures of others.",
    "source_text": {
      "work_name": "Brihat Parashara Hora Shastra",
      "chapter": "24",
      "verse": "18",
      "page": null,
      "quote": "When Dhana's lord is in Ari Bhava along with a benefic, the native will gain wealth through his enemies. It is know as satramooladdhana yoga.",
      "translation": null
    },
    "domain": "business",
    "event_family": "profit_growth",
    "event_subtype": ["litigation_prone", "sudden_gains"],
    "rule_type": "yoga",
    "status": "active",
    "priority": 82,
    "polarity": "mixed",
    "timing_band": "none",
    "conditions": {
      "all_of": [
        "The Lord of the 2nd house is positioned in the 6th house (Ari Bhava)",
        "The Lord of the 2nd house is conjoined with a benefic planet"
      ],
      "any_of": [],
      "none_of": []
    },
    "signals": {
      "dasha": [],
      "transit": [],
      "houses": ["2", "6"],
      "planets": ["2nd_lord"],
      "nakshatra": [],
      "d9": [],
      "sensitive_points": []
    },
    "interpretation": {
      "meaning": "Satramooladdhana Yoga indicates a business archetype where wealth is extracted from conflict, enemies, or litigation. It suggests a career managing the debts, legal disputes, or failures of others.",
      "mode": "litigation_prone",
      "quality": "mixed",
      "confidence": 0.85
    },
    "window": null,
    "weights": {
      "dasha_weight": 0.0,
      "transit_weight": 0.0,
      "fast_trigger_weight": 0.0,
      "classical_weight": 0.9
    },
    "outputs": {
      "symbolic_label": "litigation_wealth_archetype",
      "likelihood_band": "moderate",
      "timing_band": "none",
      "recommended_action": "leverage_conflict_resolution_skills"
    },
    "metadata": {
      "notes": "Archetypal indicator of litigation-based professions or businesses profiting from conflict and restructuring."
    }
  },
  {
    "rule_id": "nirayana_mars_sun_moon_partnership",
    "name": "Mars-Sun-Moon Combination — Partnership Business Wealth",
    "description": "Mars in combination with Sun and Moon (exalted or strong) gives wealth through business partnership.",
    "source_text": {
      "work_name": "Predictive Astrology Through The Nirayana System",
      "chapter": null,
      "verse": null,
      "page": "28",
      "quote": "Mars exalted or alone in combination with Sun and Moon gives wealth through marriage and business partnership;",
      "translation": null
    },
    "domain": "business",
    "event_family": "business_partnership",
    "event_subtype": ["partnership_business"],
    "rule_type": "combination",
    "status": "active",
    "priority": 80,
    "polarity": "supportive",
    "timing_band": "none",
    "conditions": {
      "all_of": [
        "Mars is in combination with the Sun and the Moon"
      ],
      "any_of": [
        "Mars is exalted",
        "Mars is alone (in its sign)"
      ],
      "none_of": []
    },
    "signals": {
      "dasha": [],
      "transit": [],
      "houses": [],
      "planets": ["Mars", "Sun", "Moon"],
      "nakshatra": [],
      "d9": [],
      "sensitive_points": []
    },
    "interpretation": {
      "meaning": "Symbolic indicator of wealth generation through strong alliances. Mars providing the energetic drive, harmonized with the luminaries, favors cooperative business partnerships.",
      "mode": "partnership_business",
      "quality": "supportive",
      "confidence": 0.8
    },
    "window": null,
    "weights": {
      "dasha_weight": 0.0,
      "transit_weight": 0.0,
      "fast_trigger_weight": 0.0,
      "classical_weight": 0.85
    },
    "outputs": {
      "symbolic_label": "partnership_wealth_archetype",
      "likelihood_band": "moderate",
      "timing_band": "none",
      "recommended_action": "pursue_joint_ventures"
    },
    "metadata": {
      "notes": "An astrological archetype for successful joint ventures."
    }
  },
  {
    "rule_id": "nirayana_mercury_10th_import_export",
    "name": "Mercury Alone in 10th — Merchant and Export Business",
    "description": "Mercury situated independently in the career house is the classic signature of the merchant and trader. It signifies high-volume transactions, logistics, import/export, and commission-based scalable businesses.",
    "source_text": {
      "work_name": "Predictive Astrology Through The Nirayana System",
      "chapter": null,
      "verse": null,
      "page": "224",
      "quote": "If alone: Exporter, wholesaler, distributor or commission agent. In airy signs, Mercury in 10 gives fluent speech for business activities.",
      "translation": null
    },
    "domain": "business",
    "event_family": "scaling",
    "event_subtype": ["import_export", "scalable_business"],
    "rule_type": "house_activation",
    "status": "active",
    "priority": 88,
    "polarity": "supportive",
    "timing_band": "none",
    "conditions": {
      "all_of": [
        "Mercury is positioned in the 10th house",
        "Mercury is alone (unconjoined)"
      ],
      "any_of": [],
      "none_of": []
    },
    "signals": {
      "dasha": [],
      "transit": [],
      "houses": ["10"],
      "planets": ["Mercury"],
      "nakshatra": [],
      "d9": [],
      "sensitive_points": []
    },
    "interpretation": {
      "meaning": "Mercury situated independently in the career house is the classic signature of the merchant and trader. It signifies high-volume transactions, logistics, import/export, and commission-based scalable businesses.",
      "mode": "import_export",
      "quality": "supportive",
      "confidence": 0.9
    },
    "window": null,
    "weights": {
      "dasha_weight": 0.0,
      "transit_weight": 0.0,
      "fast_trigger_weight": 0.0,
      "classical_weight": 0.9
    },
    "outputs": {
      "symbolic_label": "merchant_trader_archetype",
      "likelihood_band": "high",
      "timing_band": "none",
      "recommended_action": "build_scalable_commercial_operations"
    },
    "metadata": {
      "notes": "If Mercury is in an airy sign (Gemini, Libra, Aquarius), it adds advanced fluency and public relations skills to the business."
    }
  },
  {
    "rule_id": "jataka_parijata_mars_navamsa_technology",
    "name": "Mars Navamsa — Technology and Engineering Business",
    "description": "When the livelihood Navamsa is ruled by Mars (Aries/Scorpio), it creates the archetype for technical businesses involving fire, machinery, engineering, or confrontational arenas.",
    "source_text": {
      "work_name": "Jataka Parijata",
      "chapter": "15",
      "verse": "46-47",
      "page": null,
      "quote": "If the Navamsa in question belong to Mars, the person gains a livelihood by metallurgy, by working in fire... and by engaging in other people's quarrels, in any act of daring",
      "translation": null
    },
    "domain": "business",
    "event_family": "business_launch",
    "event_subtype": ["technology_business", "litigation_prone"],
    "rule_type": "d9",
    "status": "active",
    "priority": 82,
    "polarity": "mixed",
    "timing_band": "none",
    "conditions": {
      "all_of": [